{
  "id": "zeve-os-business",
  "name": "泽玮 OS 业务决策",
  "description": "组合机会界定、方案设计、单位经济性、实验规划、个人 AI 工作流和决策备忘录能力",
  "version": "0.2.0",
  "skills": [
    "business-opportunity-framer",
    "business-offer-designer",
    "business-unit-economics-reviewer",
    "business-experiment-planner",
    "business-decision-memo",
    "zeve-personal-ai-workflow-designer"
  ]
}
