{
  "id": "zeve-os-private-domain",
  "name": "泽玮 OS 私域运营",
  "description": "组合人群分层、活动策划、对话复盘、生命周期和留存实验能力",
  "version": "0.1.0",
  "skills": [
    "private-domain-audience-segmenter",
    "private-domain-campaign-planner",
    "private-domain-conversation-reviewer",
    "private-domain-lifecycle-designer",
    "private-domain-retention-experiment-planner"
  ]
}
