{
  "id": "zeve-os-content",
  "name": "泽玮 OS 内容运营",
  "description": "组合内容策略、角度、演示叙事、生产排期、质量与发布审查、再利用、AI 搜索可见性和视频体积优化能力",
  "version": "0.3.0",
  "skills": [
    "content-strategy-brief",
    "content-angle-generator",
    "content-production-planner",
    "content-quality-reviewer",
    "content-repurpose-planner",
    "content-ai-discoverability-optimizer",
    "content-video-size-optimizer",
    "content-presentation-narrative-designer",
    "content-short-video-publish-reviewer"
  ]
}
